Title,Date,Url,Author
Let's Think Dot by Dot: Hidden Computation in Transformer Language Models,2024-04-24,http://arxiv.org/abs/2404.15758,Jacob Pfau; William Merrill; Samuel R. Bowman
Chain of Thought Empowers Transformers to Solve Inherently Serial Problems,2024-02-20,http://arxiv.org/abs/2402.12875,Zhiyuan Li; Hong Liu; Denny Zhou; Tengyu Ma
Towards Revealing the Mystery behind Chain of Thought: A Theoretical Perspective,2023-12-22,http://arxiv.org/abs/2305.15408,Guhao Feng; Bohang Zhang; Yuntian Gu; Haotian Ye; Di He; Liwei Wang
Why Can Large Language Models Generate Correct Chain-of-Thoughts?,2023-10-20,http://arxiv.org/abs/2310.13571,Rasul Tutunov; Antoine Grosnit; Juliusz Ziomek; Jun Wang; Haitham Bou-Ammar
How Large Language Models Implement Chain-of-Thought?,2023-10-13,https://openreview.net/forum?id=b2XfOm3RJa,Yiqun Wang; Sile Hu; Yonggang Zhang; Xiang Tian; Xuesong Liu; Yaowu Chen; Xu Shen; Jieping Ye
The Expressive Power of Transformers with Chain of Thought,2023-10-13,https://openreview.net/forum?id=NjNGlPh8Wh,William Merrill; Ashish Sabharwal
Iteration Head: A Mechanistic Study of Chain-of-Thought,2024-06-04,http://arxiv.org/abs/2406.02128,Vivien Cabannes; Charles Arnal; Wassim Bouaziz; Alice Yang; Francois Charton; Julia Kempe
On the Representational Capacity of Neural Language Models with Chain-of-Thought Reasoning,2024-06-20,http://arxiv.org/abs/2406.14197,Franz Nowak; Anej Svete; Alexandra Butoi; Ryan Cotterell
Unveiling the Statistical Foundations of Chain-of-Thought Prompting Methods,2024-08-25,http://arxiv.org/abs/2408.14511,Xinyang Hu; Fengzhuo Zhang; Siyu Chen; Zhuoran Yang
"Deciphering the Factors Influencing the Efficacy of Chain-of-Thought: Probability, Memorization, and Noisy Reasoning",2024-07-01,http://arxiv.org/abs/2407.01687,Akshara Prabhakar; Thomas L. Griffiths; R. Thomas McCoy
"Autoregressive + Chain of Thought (CoT) ≃ Recurrent: Recurrence's Role in Language Models and a Revist of Recurrent Transformer",2024-09-14,http://arxiv.org/abs/2409.09239,Xiang Zhang; Muhammad Abdul-Mageed; Laks V.S. Lakshmanan
Training Nonlinear Transformers for Chain-of-Thought Inference: A Theoretical Generalization Analysis,2024-10-03,http://arxiv.org/abs/2410.02167,Hongkang Li; Meng Wang; Songtao Lu; Xiaodong Cui; Pin-Yu Chen
From Sparse Dependence to Sparse Attention: Unveiling How Chain-of-Thought Enhances Transformer Sample Efficiency,2024-10-07,http://arxiv.org/abs/2410.05459,Kaiyue Wen; Huaqing Zhang; Hongzhou Lin; Jingzhao Zhang
A Theoretical Understanding of Chain-of-Thought: Coherent Reasoning and Error-Aware Demonstration,2024-10-21,https://arxiv.org/abs/2410.16540v1,Yingqian Cui; Pengfei He; Xianfeng Tang; Qi He; Chen Luo; Jiliang Tang; Yue Xing
What Happened in LLMs Layers when Trained for Fast vs. Slow Thinking: A Gradient Perspective,2024-10-31,http://arxiv.org/abs/2410.23743,Ming Li; Yanhong Li; Tianyi Zhou
Rethinking Thinking Tokens: Understanding Why They Underperform in Practice,2024-11-18,http://arxiv.org/abs/2411.11371,Sreeram Vennam; David Valente; David Herel; Ponnurangam Kumaraguru
Transformers Provably Solve Parity Efficiently with Chain of Thought,2024-10-11,http://arxiv.org/abs/2410.08633,Juno Kim; Taiji Suzuki
Geometric Signatures of Reasoning: A Spectral Perspective on Task Hardness,2026-07-02,http://arxiv.org/abs/2607.01571v1,Aria Masoomi;Mahsa Bazzaz;Adel Javanmard;Vahab Mirrokni
What LLMs explain is not what they believe: Evaluating explanation sufficiency under models' own input beliefs,2026-06-26,http://arxiv.org/abs/2606.28615v1,Nhi Nguyen;Shauli Ravfogel;Rajesh Ranganath
Scheduling Thoughts: Learning the Order of Thought in Diffusion Language Models,2026-06-22,http://arxiv.org/abs/2606.23567v1,Jiawei Xu;Minghui Liu;Aakriti Agrawal;Yifan Chen;Furong Huang
Provable Benefits of RLVR over SFT for Reasoning Models: Learning to Backtrack Efficiently,2026-06-22,http://arxiv.org/abs/2606.22938v1,Stanley Wei;Juno Kim
A Verifiable Search Is Not a Learnable Chain-of-Thought,2026-06-20,http://arxiv.org/abs/2606.21884v1,Harsh Patel

Learning through Internalization,2026-06-18,http://arxiv.org/abs/2606.20937v1,Nikolaos Tsilivis;Nirmit Joshi;Marko Medvedev;Julia Kempe;Nati Srebro

What Makes Effective Supervision in Latent Chain-of-Thought: An Information-Theoretic Analysis,2026-06-18,http://arxiv.org/abs/2606.20075v1,Xinghao Chen;Chak Tou Leong;Wenjin Guo;Jian Wang;Wenjie Li;Xiaoyu Shen

Efficiently Representing Algorithms With Chain-of-Thought Transformers,2026-06-18,http://arxiv.org/abs/2606.19697v1,Yanhong Li;Anej Svete;Ashish Sabharwal;William Merrill

Free Energy Heuristics: Fast-And-Frugal Cognition as Active Inference Under Uncertain Precision,2026-06-14,http://arxiv.org/abs/2606.15877v1,Alex Bogdan

Tight Sample Complexity of Transformers,2026-06-08,http://arxiv.org/abs/2606.09731v1,Chenxiao Yang;Nathan Srebro;Zhiyuan Li

An Asymptotic Theory of Chain-of-Thought in In-Context Learning,2026-06-02,http://arxiv.org/abs/2606.03217v1,Kaito Takanami;Cengiz Pehlevan

Unveiling the Entropy Dynamics of Chain-of-Thought Reasoning,2026-06-01,http://arxiv.org/abs/2606.02020v1,Ting Xu;Xu He;Yupu Lu;Jiankai Sun;Dong Li;Wai Lam;Jianye Hao

The Deterministic Horizon: When Extended Reasoning Fails and Tool Delegation Becomes Necessary,2026-05-29,http://arxiv.org/abs/2606.00376v1,Dongxin Guo;Jikun Wu;Siu Ming Yiu

Revealing Algorithmic Deductive Circuits for Logical Reasoning,2026-05-27,http://arxiv.org/abs/2605.27824v1,Phuong Minh Nguyen;Tien Huu Dang;Naoya Inoue

Do Models Know Why They Changed Their Mind? Interpretability and Faithfulness of Chain-of-Thought Under Knowledge Conflict,2026-05-26,http://arxiv.org/abs/2605.27773v1,Pruthvinath Jeripity Venkata
